{
  "schema_version": 1,
  "project": "private-vm",
  "role": "workstation",
  "bundles": {
    "basic": [
      "curl",
      "evince",
      "file-roller",
      "firefox",
      "git",
      "jq",
      "keepassxc",
      "mousepad",
      "openssh-client",
      "ristretto",
      "thunar",
      "xfce4-terminal",
      "zenity"
    ],
    "office": [
      "curl",
      "evince",
      "file-roller",
      "firefox",
      "git",
      "hunspell",
      "hunspell-en-us",
      "jq",
      "keepassxc",
      "libreoffice",
      "mousepad",
      "openssh-client",
      "ristretto",
      "thunar",
      "xfce4-terminal",
      "zenity"
    ],
    "development": [
      "cargo",
      "cmake",
      "curl",
      "evince",
      "file-roller",
      "firefox",
      "gcc",
      "gdb",
      "git",
      "gnumake",
      "go",
      "gradle",
      "hunspell",
      "hunspell-en-us",
      "jdk",
      "jq",
      "keepassxc",
      "kotlin",
      "libreoffice",
      "mousepad",
      "nodejs",
      "openssh-client",
      "pkg-config",
      "python",
      "ristretto",
      "rustc",
      "thunar",
      "vscodium",
      "xfce4-terminal",
      "zenity"
    ]
  }
}
